{"schemaVersion":1,"dataRevision":3,"dataset":"dx","distributionSize":1024,"shard":{"shihai":19},"index":{"dice":{"start":0,"count":100},"critical":{"start":2,"count":10}},"distributions":[[{"offset":0,"values":[1]},{"offset":0,"values":[1]},{"offset":0,"values":[1]},{"offset":0,"values":[1]},{"offset":0,"values":[1]},{"offset":0,"values":[1]},{"offset":0,"values":[1]},{"offset":0,"values":[1]},{"offset":0,"values":[1]},{"offset":0,"values":[1]}],[{"offset":0,"values":[1]},{"offset":0,"values":[1]},{"offset":0,"values":[1]},{"offset":0,"values":[1]},{"offset":0,"values":[1]},{"offset":0,"values":[1]},{"offset":0,"values":[1]},{"offset":0,"values":[1]},{"offset":0,"values":[1]},{"offset":0,"values":[1]}],[{"offset":0,"values":[1]},{"offset":0,"values":[1]},{"offset":0,"values":[1]},{"offset":0,"values":[1]},{"offset":0,"values":[1]},{"offset":0,"values":[1]},{"offset":0,"values":[1]},{"offset":0,"values":[1]},{"offset":0,"values":[1]},{"offset":0,"values":[1]}],[{"offset":0,"values":[1]},{"offset":0,"values":[1]},{"offset":0,"values":[1]},{"offset":0,"values":[1]},{"offset":0,"values":[1]},{"offset":0,"values":[1]},{"offset":0,"values":[1]},{"offset":0,"values":[1]},{"offset":0,"values":[1]},{"offset":0,"values":[1]}],[{"offset":0,"values":[1]},{"offset":0,"values":[1]},{"offset":0,"values":[1]},{"offset":0,"values":[1]},{"offset":0,"values":[1]},{"offset":0,"values":[1]},{"offset":0,"values":[1]},{"offset":0,"values":[1]},{"offset":0,"values":[1]},{"offset":0,"values":[1]}],[{"offset":0,"values":[1]},{"offset":0,"values":[1]},{"offset":0,"values":[1]},{"offset":0,"values":[1]},{"offset":0,"values":[1]},{"offset":0,"values":[1]},{"offset":0,"values":[1]},{"offset":0,"values":[1]},{"offset":0,"values":[1]},{"offset":0,"values":[1]}],[{"offset":0,"values":[1]},{"offset":0,"values":[1]},{"offset":0,"values":[1]},{"offset":0,"values":[1]},{"offset":0,"values":[1]},{"offset":0,"values":[1]},{"offset":0,"values":[1]},{"offset":0,"values":[1]},{"offset":0,"values":[1]},{"offset":0,"values":[1]}],[{"offset":0,"values":[1]},{"offset":0,"values":[1]},{"offset":0,"values":[1]},{"offset":0,"values":[1]},{"offset":0,"values":[1]},{"offset":0,"values":[1]},{"offset":0,"values":[1]},{"offset":0,"values":[1]},{"offset":0,"values":[1]},{"offset":0,"values":[1]}],[{"offset":0,"values":[1]},{"offset":0,"values":[1]},{"offset":0,"values":[1]},{"offset":0,"values":[1]},{"offset":0,"values":[1]},{"offset":0,"values":[1]},{"offset":0,"values":[1]},{"offset":0,"values":[1]},{"offset":0,"values":[1]},{"offset":0,"values":[1]}],[{"offset":0,"values":[1]},{"offset":0,"values":[1]},{"offset":0,"values":[1]},{"offset":0,"values":[1]},{"offset":0,"values":[1]},{"offset":0,"values":[1]},{"offset":0,"values":[1]},{"offset":0,"values":[1]},{"offset":0,"values":[1]},{"offset":0,"values":[1]}],[{"offset":0,"values":[1]},{"offset":0,"values":[1]},{"offset":0,"values":[1]},{"offset":0,"values":[1]},{"offset":0,"values":[1]},{"offset":0,"values":[1]},{"offset":0,"values":[1]},{"offset":0,"values":[1]},{"offset":0,"values":[1]},{"offset":0,"values":[1]}],[{"offset":0,"values":[1]},{"offset":0,"values":[1]},{"offset":0,"values":[1]},{"offset":0,"values":[1]},{"offset":0,"values":[1]},{"offset":0,"values":[1]},{"offset":0,"values":[1]},{"offset":0,"values":[1]},{"offset":0,"values":[1]},{"offset":0,"values":[1]}],[{"offset":0,"values":[1]},{"offset":0,"values":[1]},{"offset":0,"values":[1]},{"offset":0,"values":[1]},{"offset":0,"values":[1]},{"offset":0,"values":[1]},{"offset":0,"values":[1]},{"offset":0,"values":[1]},{"offset":0,"values":[1]},{"offset":0,"values":[1]}],[{"offset":0,"values":[1]},{"offset":0,"values":[1]},{"offset":0,"values":[1]},{"offset":0,"values":[1]},{"offset":0,"values":[1]},{"offset":0,"values":[1]},{"offset":0,"values":[1]},{"offset":0,"values":[1]},{"offset":0,"values":[1]},{"offset":0,"values":[1]}],[{"offset":0,"values":[1]},{"offset":0,"values":[1]},{"offset":0,"values":[1]},{"offset":0,"values":[1]},{"offset":0,"values":[1]},{"offset":0,"values":[1]},{"offset":0,"values":[1]},{"offset":0,"values":[1]},{"offset":0,"values":[1]},{"offset":0,"values":[1]}],[{"offset":0,"values":[1]},{"offset":0,"values":[1]},{"offset":0,"values":[1]},{"offset":0,"values":[1]},{"offset":0,"values":[1]},{"offset":0,"values":[1]},{"offset":0,"values":[1]},{"offset":0,"values":[1]},{"offset":0,"values":[1]},{"offset":0,"values":[1]}],[{"offset":0,"values":[1]},{"offset":0,"values":[1]},{"offset":0,"values":[1]},{"offset":0,"values":[1]},{"offset":0,"values":[1]},{"offset":0,"values":[1]},{"offset":0,"values":[1]},{"offset":0,"values":[1]},{"offset":0,"values":[1]},{"offset":0,"values":[1]}],[{"offset":0,"values":[1]},{"offset":0,"values":[1]},{"offset":0,"values":[1]},{"offset":0,"values":[1]},{"offset":0,"values":[1]},{"offset":0,"values":[1]},{"offset":0,"values":[1]},{"offset":0,"values":[1]},{"offset":0,"values":[1]},{"offset":0,"values":[1]}],[{"offset":0,"values":[1]},{"offset":0,"values":[1]},{"offset":0,"values":[1]},{"offset":0,"values":[1]},{"offset":0,"values":[1]},{"offset":0,"values":[1]},{"offset":0,"values":[1]},{"offset":0,"values":[1]},{"offset":0,"values":[1]},{"offset":0,"values":[1]}],[{"offset":0,"values":[1]},{"offset":0,"values":[1]},{"offset":0,"values":[1]},{"offset":0,"values":[1]},{"offset":0,"values":[1]},{"offset":0,"values":[1]},{"offset":0,"values":[1]},{"offset":0,"values":[1]},{"offset":0,"values":[1]},{"offset":0,"values":[1]}],[{"offset":1,"values":[0.878423,0,0,0,0,0,0,0,0,0,0.106796,0,0,0,0,0,0,0,0,0,0.012984,0,0,0,0,0,0,0,0,0,0.001579,0,0,0,0,0,0,0,0,0,0.000192,0,0,0,0,0,0,0,0,0,2.3e-05,0,0,0,0,0,0,0,0,0,3e-06]},{"offset":1,"values":[0.878423,0.110047,0,0,0,0,0,0,0,0,0.010128,0.001269,0,0,0,0,0,0,0,0,0.000117,1.5e-05,0,0,0,0,0,0,0,0,1e-06]},{"offset":1,"values":[0.878423,0.110047,0.010731,0,0,0,0,0,0,0,0.000701,8.8e-05,9e-06,0,0,0,0,0,0,0,1e-06]},{"offset":1,"values":[0.878423,0.110048,0.010731,0.000761,0,0,0,0,0,0,3.2e-05,4e-06,1e-06]},{"offset":1,"values":[0.878423,0.110048,0.010731,0.000761,3.6e-05,0,0,0,0,0,1e-06]},{"offset":1,"values":[0.878423,0.110048,0.010731,0.000761,3.6e-05,1e-06]},{"offset":1,"values":[0.878423,0.110048,0.010731,0.000761,3.6e-05,1e-06]},{"offset":1,"values":[0.878423,0.110048,0.010731,0.000761,3.6e-05,1e-06]},{"offset":1,"values":[0.878423,0.110048,0.010731,0.000761,3.6e-05,1e-06]},{"offset":1,"values":[0.878423,0.110048,0.010731,0.000761,3.6e-05,1e-06]}],[{"offset":1,"values":[0.63527,0,0,0,0,0,0,0,0,0,0.293782,0,0,0,0,0,0,0,0,0,0.059411,0,0,0,0,0,0,0,0,0,0.009816,0,0,0,0,0,0,0,0,0,0.001477,0,0,0,0,0,0,0,0,0,0.000211,0,0,0,0,0,0,0,0,0,2.9e-05,0,0,0,0,0,0,0,0,0,4e-06]},{"offset":1,"values":[0.63527,0.307084,0,0,0,0,0,0,0,0,0.048395,0.008161,0,0,0,0,0,0,0,0,0.000937,0.000137,0,0,0,0,0,0,0,0,1.4e-05,2e-06]},{"offset":1,"values":[0.63527,0.307084,0.052061,0,0,0,0,0,0,0,0.00477,0.000725,8.3e-05,0,0,0,0,0,0,0,6e-06,1e-06]},{"offset":1,"values":[0.63527,0.307084,0.052061,0.005256,0,0,0,0,0,0,0.000284,4.1e-05,4e-06]},{"offset":1,"values":[0.63527,0.307084,0.052061,0.005256,0.000319,0,0,0,0,0,9e-06,1e-06]},{"offset":1,"values":[0.63527,0.307084,0.052061,0.005256,0.000319,1e-05]},{"offset":1,"values":[0.63527,0.307084,0.052061,0.005256,0.000319,1e-05]},{"offset":1,"values":[0.63527,0.307084,0.052061,0.005256,0.000319,1e-05]},{"offset":1,"values":[0.63527,0.307084,0.052061,0.005256,0.000319,1e-05]},{"offset":1,"values":[0.63527,0.307084,0.052061,0.005256,0.000319,1e-05]}],[{"offset":1,"values":[0.379959,0,0,0,0,0,0,0,0,0,0.437039,0,0,0,0,0,0,0,0,0,0.143751,0,0,0,0,0,0,0,0,0,0.032104,0,0,0,0,0,0,0,0,0,0.005968,0,0,0,0,0,0,0,0,0,0.000997,0,0,0,0,0,0,0,0,0,0.000155,0,0,0,0,0,0,0,0,0,2.3e-05,0,0,0,0,0,0,0,0,0,3e-06,0,0,0,0,0,0,0,0,0,1e-06]},{"offset":1,"values":[0.379959,0.46554999999999996,0,0,0,0,0,0,0,0,0.122163,0.027621,0,0,0,0,0,0,0,0,0.003944,0.00067,0,0,0,0,0,0,0,0,8e-05,1.2e-05,0,0,0,0,0,0,0,0,1e-06]},{"offset":1,"values":[0.379959,0.46554999999999996,0.133825,0,0,0,0,0,0,0,0.017062,0.00314,0.000422,0,0,0,0,0,0,0,3.6e-05,5e-06,1e-06]},{"offset":1,"values":[0.379959,0.46554999999999996,0.133825,0.019109,0,0,0,0,0,0,0.001315,0.000214,2.6e-05,2e-06]},{"offset":1,"values":[0.379959,0.465549,0.133825,0.019109,0.001497,0,0,0,0,0,5.2e-05,8e-06,1e-06]},{"offset":1,"values":[0.379959,0.465549,0.133825,0.019109,0.001497,6e-05,0,0,0,0,1e-06]},{"offset":1,"values":[0.379959,0.465549,0.133825,0.019109,0.001497,6e-05,1e-06]},{"offset":1,"values":[0.379959,0.465549,0.133825,0.019109,0.001497,6e-05,1e-06]},{"offset":1,"values":[0.379959,0.465549,0.133825,0.019109,0.001497,6e-05,1e-06]},{"offset":1,"values":[0.379959,0.465549,0.133825,0.019109,0.001497,6e-05,1e-06]}],[{"offset":1,"values":[0.192731,0,0,0,0,0,0,0,0,0,0.46813899999999997,0,0,0,0,0,0,0,0,0,0.244801,0,0,0,0,0,0,0,0,0,0.073498,0,0,0,0,0,0,0,0,0,0.016843,0,0,0,0,0,0,0,0,0,0.003295,0,0,0,0,0,0,0,0,0,0.000581,0,0,0,0,0,0,0,0,0,9.5e-05,0,0,0,0,0,0,0,0,0,1.5e-05,0,0,0,0,0,0,0,0,0,2e-06]},{"offset":1,"values":[0.192731,0.510738,0,0,0,0,0,0,0,0,0.216817,0.065456,0,0,0,0,0,0,0,0,0.011598,0.002293,0,0,0,0,0,0,0,0,0.000309,5.1e-05,0,0,0,0,0,0,0,0,6e-06,1e-06]},{"offset":1,"values":[0.192731,0.510737,0.242688,0,0,0,0,0,0,0,0.042673,0.0095,0.001499,0,0,0,0,0,0,0,0.000145,2.4e-05,3e-06]},{"offset":1,"values":[0.192731,0.510737,0.242688,0.048683,0,0,0,0,0,0,0.004252,0.000789,0.000109,9.999999999999999e-06,0,0,0,0,0,0,1e-06]},{"offset":1,"values":[0.192731,0.510737,0.242688,0.048683,0.004917,0,0,0,0,0,0.000206,3.4e-05,4e-06]},{"offset":1,"values":[0.192731,0.510737,0.242688,0.048683,0.004917,0.000239,0,0,0,0,4e-06,1e-06]},{"offset":1,"values":[0.192731,0.510737,0.242688,0.048683,0.004917,0.000239,5e-06]},{"offset":1,"values":[0.192731,0.510737,0.242688,0.048683,0.004917,0.000239,5e-06]},{"offset":1,"values":[0.192731,0.510737,0.242688,0.048683,0.004917,0.000239,5e-06]},{"offset":1,"values":[0.192731,0.510737,0.242688,0.048683,0.004917,0.000239,5e-06]}],[{"offset":1,"values":[0.085075,0,0,0,0,0,0,0,0,0,0.405224,0,0,0,0,0,0,0,0,0,0.329546,0,0,0,0,0,0,0,0,0